{
  "$schema": "https://json-schema.org/draft/2020-12/schema",
  "$id": "https://ods.local/ods-help/json-model/envelope",
  "title": "Parser Envelope (005)",
  "description": "Common output wrapper for any parser. The orchestrator validates only these fields; model — parser zone.",
  "implementation_status": "implemented",
  "spec": "005-code-analysis",
  "type": "object",
  "required": [
    "parser_id",
    "schema_version",
    "project_id",
    "analysis_run_id",
    "generated_at",
    "files_analyzed",
    "model"
  ],
  "additionalProperties": false,
  "properties": {
    "parser_id": {
      "type": "string",
      "description": "Module identifier from parsers/*/manifest.json (typescript, csharp, compose, openapi, …)"
    },
    "schema_version": {
      "type": "string",
      "description": "Version native JSON inside model; adapter ingest selected by parser_id + schema_version"
    },
    "project_id": {
      "type": "string",
      "format": "uuid",
      "description": "FK → Project (002)"
    },
    "analysis_run_id": {
      "type": "string",
      "format": "uuid",
      "description": "FK → AnalysisRun (005); all nodes/edges ingest bound to this run"
    },
    "generated_at": {
      "type": "string",
      "format": "date-time",
      "description": "ISO-8601 UTC; generation moment envelope parser"
    },
    "files_analyzed": {
      "type": "array",
      "description": "POSIX-relative paths working_copy_root, processed by this parser run",
      "items": { "type": "string" }
    },
    "model": {
      "description": "Native extract; schema — one of native-*.schema.json by parser_id and schema_version"
    }
  }
}
