{
  "parser_id": "csharp",
  "schema_version": "1",
  "project_id": "00000000-0000-4000-8000-000000000001",
  "analysis_run_id": "00000000-0000-4000-8000-000000000002",
  "generated_at": "2026-07-12T00:00:00.000Z",
  "files_analyzed": ["Controllers/WeatherForecastController.cs"],
  "model": {
    "symbols": [
      {
        "name": "WeatherForecastController",
        "kind": "class",
        "path": "Controllers/WeatherForecastController.cs",
        "qualified_name": "WebApplication1.Controllers.WeatherForecastController",
        "refs": [
          {
            "type": "inherits",
            "name": "ControllerBase",
            "kind": "class",
            "qualified_name": "ControllerBase"
          }
        ]
      }
    ]
  }
}
